Station,latitude,longitude,address
Stonebridge Park,51.5441099,-0.2762285,"Stonebridge Park, Argenta Way, London Borough of Brent, Greater London, England, NW10 0RW, United Kingdom"
Stratford,51.541289,-0.0035472,"Stratford, Meridian Square, Stratford, London Borough of Newham, Greater London, England, E15 1DA, United Kingdom"
Stratford High Street,51.5376469,-0.0001288,"Stratford High Street, Bridge Road, Stratford, London Borough of Newham, Greater London, England, E15 3FF, United Kingdom"
Stratford International,51.5447954,-0.0087494,"Stratford International, International Square, Stratford, London Borough of Newham, Greater London, England, E20 1EE, United Kingdom"
Sudbury Hill,51.5568815,-0.3362525,"Sudbury Hill, Greenford Road, Sudbury Hill, London Borough of Harrow, Greater London, England, HA1 3RA, United Kingdom"
Sudbury Town,51.5508247,-0.3156392,"Sudbury Town, Station Approach, Sudbury, London Borough of Brent, Greater London, England, HA0 2LA, United Kingdom"
Surrey Quays,51.4934207,-0.0478319,"Surrey Quays, Lower Road, Surrey Quays, Rotherhithe, London Borough of Southwark, Greater London, England, SE16 2UF, United Kingdom"
Swiss Cottage,51.543722,-0.174982,"Swiss Cottage, Finchley Road, Swiss Cottage, Belsize Park, London Borough of Camden, Greater London, England, NW3 6LS, United Kingdom"
Sydenham SR,,,
Taplow,51.4887234,-0.0868922,"Taplow, Thurlow Street, Walworth, London Borough of Southwark, Greater London, England, SE17 2SL, United Kingdom"
Temple,51.5109659,-0.1143345,"Temple, Victoria Embankment Gardens, St Clement Danes, City of Westminster, Greater London, England, WC2R 2PH, United Kingdom"
Theobalds Grove,,,
Theydon Bois,,,
Tooting Bec,51.4356228,-0.1597188,"Tooting Bec, Upper Tooting Road, Upper Tooting, Balham, London Borough of Wandsworth, Greater London, England, SW17 7TS, United Kingdom"
Tooting Broadway,51.4277387,-0.1682905,"Tooting Broadway, Tooting High Street, Furzedown, London Borough of Wandsworth, Greater London, England, SW17 0TA, United Kingdom"
Tottenham Court Road,51.515401,-0.1305917,"Tottenham Court Road, Goslett Yard, Soho, City of Westminster, Greater London, England, W1D 3BG, United Kingdom"
Tottenham Hale,51.588123,-0.0599442,"Tottenham Hale, Ferry Lane, Tottenham Hale, London Borough of Haringey, Greater London, England, N17 9NA, United Kingdom"
Totteridge & Whetstone,51.6307163,-0.1791837,"Totteridge & Whetstone, Totteridge Lane, Whetstone, London Borough of Barnet, Greater London, England, N20 9QP, United Kingdom"
Tower Gateway,51.5104965,-0.0747693,"Tower Gateway, Leadenhall Market, Aldgate, City of London, Greater London, England, EC3N 1JL, United Kingdom"
Tower Hill,51.5098481,-0.0766986,"Tower Hill, Trinity Place, East Smithfield, Tower Hill, Whitechapel, London Borough of Tower Hamlets, Greater London, England, EC3N 4DJ, United Kingdom"
Tufnell Park,51.5567447,-0.1381318,"Tufnell Park, Brecknock Road, Archway, London Borough of Islington, Greater London, England, N19 5BQ, United Kingdom"
Turkey Street,51.673233,-0.0469695,"Turkey Street, Teal Close, Enfield Wash, London Borough of Enfield, Greater London, England, EN3 5TL, United Kingdom"
Turnham Green,51.4953141,-0.2549771,"Turnham Green, Turnham Green Terrace, London Borough of Hounslow, Greater London, England, W4 1LR, United Kingdom"
Turnpike Lane,51.5901482,-0.1027442,"Turnpike Lane, 1, Green Lanes, Harringay, London Borough of Haringey, Greater London, England, N15 3LA, United Kingdom"
Twyford,51.5090934,-0.2782382,"Twyford Church of England High School, Twyford Crescent, London Borough of Ealing, Greater London, England, W3 9PP, United Kingdom"
Unknown,51.5063939,-0.1004454,"Monument to the Unknown Artist, Sumner Street, Bankside, Southwark, London Borough of Southwark, Greater London, England, SE1 9JZ, United Kingdom"
Upminster,51.5589708,0.2516815,"Upminster, Station Approach, Upminster, London Borough of Havering, Greater London, England, RM14 2TH, United Kingdom"
Upminster Bridge,51.5582655,0.2347689,"Upminster Bridge, Upminster Road, Upminster Bridge, Hornchurch, London Borough of Havering, Greater London, England, RM12 6PL, United Kingdom"
Upney,51.538266,0.099626,"Upney, Upney Lane, Thames View, Barking, Greater London, England, IG11 9LS, United Kingdom"
Upper Holloway,51.563474,-0.1296473,"Upper Holloway, Wedmore Gardens, Archway, London Borough of Islington, Greater London, England, N19 4SY, United Kingdom"
Upton Park,51.5351062,0.0339842,"Upton Park, Green Street, Upton Park, London Borough of Newham, Greater London, England, E13 9AP, United Kingdom"
Uxbridge,51.5449509,-0.4816672,"Uxbridge, Greater London, England, UB8 1SB, United Kingdom"
Vauxhall,51.4874834,-0.1229297,"Vauxhall, London Borough of Lambeth, Greater London, England, SE11 5AW, United Kingdom"
Victoria,51.4951127,-0.1441234,"Victoria Station, Wilton Road, Victoria, City of Westminster, Greater London, England, SW1V 1JU, United Kingdom"
W Silvertown,51.5028811,0.0223323,"West Silvertown, North Woolwich Road, Silvertown, London Borough of Newham, Greater London, England, E16 1TX, United Kingdom"
Walthamstow Central,51.582893,-0.0199941,"Walthamstow Central, Selborne Road, London Borough of Waltham Forest, Greater London, England, E17 7JP, United Kingdom"
Walthamstow Queens Road,51.578027,-0.0256333,"Walthamstow Coroners Court, Queens Road, Leyton, Walthamstow, Greater London, England, E17 8QP, United Kingdom"
Wandsworth Road,51.4699602,-0.1384355,"Wandsworth Road, Heswall Close, Clapham, London Borough of Lambeth, Greater London, England, SW4 6AA, United Kingdom"
Wanstead,51.5756739,0.0277989,"Wanstead, London Borough of Redbridge, Greater London, England, E11 2RJ, United Kingdom"
Wanstead Park,51.5517605,0.0260733,"Wanstead Park, Woodgrange Road, Forest Gate, London Borough of Newham, Greater London, England, E7 0HX, United Kingdom"
Wapping,51.5071316,-0.0620152,"Wapping, London Borough of Tower Hamlets, Greater London, England, E1W 2JX, United Kingdom"
Warren Street,51.5247178,-0.1385303,"Warren Street, Euston Road, Fitzrovia, London Borough of Camden, Greater London, England, W1T 5PE, United Kingdom"
Warwick Avenue,51.5229834,-0.1833083,"Warwick Avenue, Westbourne Green, Paddington, City of Westminster, Greater London, England, W9 2PT, United Kingdom"
Waterloo,51.5030015,-0.1139812,"Waterloo, Waterloo Social Sidings, South Bank, Waterloo, London Borough of Lambeth, Greater London, England, SE1 7NJ, United Kingdom"
Watford High Street,,,
Watford Junction,51.6893596,-0.419174,"Watford Junction, Studio Tour Drive, Warner Bros. Studios Leavesden, Abbots Langley, Leavesden, Three Rivers, Hertfordshire, England, WD25 7LP, United Kingdom"
Watford Met,,,
Wembley Central,51.5523278,-0.2966751,"Wembley Central, Wembley Central Square, Sudbury, London Borough of Brent, Greater London, England, HA9 7AJ, United Kingdom"
Wembley Park,51.5634786,-0.2796983,"Wembley Park, Bridge Road, London Borough of Brent, Greater London, England, HA9 9AA, United Kingdom"
West Acton,51.5183524,-0.280413,"West Acton, Saxon Drive, Park Royal, London Borough of Ealing, Greater London, England, W3 0NX, United Kingdom"
West Brompton,51.4869765,-0.1951854,"West Brompton, Old Brompton Road, Earl's Court, Royal Borough of Kensington and Chelsea, Greater London, England, SW5 9JU, United Kingdom"
West Croydon,51.378808,-0.1020387,"West Croydon, Station Road, Broad Green, London Borough of Croydon, Greater London, England, CR0 2TA, United Kingdom"
West Drayton,51.503513,-0.4662704,"West Drayton, London Borough of Hillingdon, Greater London, England, UB7 7GD, United Kingdom"
West Ealing,51.5135365,-0.3206893,"West Ealing, Manor Road, Hanwell, London Borough of Ealing, Greater London, England, W13 0LJ, United Kingdom"
West Finchley,51.6088451,-0.1946371,"West Finchley, London Borough of Barnet, Greater London, England, N3 1AH, United Kingdom"
West Ham,51.5280966,0.0045685,"West Ham, West Ham Footbridge, Mill Meads, West Ham, London Borough of Newham, Greater London, England, E15 3BN, United Kingdom"
West Hampstead,51.5468194,-0.1899646,"West Hampstead, Blackburn Road, West Hampstead, London Borough of Camden, Greater London, England, NW6 1RZ, United Kingdom"
West Hampstead LO,51.5509898,-0.1917279,"West Hampstead, London Borough of Camden, Greater London, England, NW6 1RB, United Kingdom"
West Harrow,51.5795991,-0.3531364,"West Harrow, The Gardens, Rayners Lane, London Borough of Harrow, Greater London, England, HA1 4FP, United Kingdom"
West India Quay,51.5067417,-0.0204833,"West India Quay, North Quay, Canary Wharf, London Borough of Tower Hamlets, Greater London, England, E14 4AY, United Kingdom"
West Kensington,51.4907023,-0.2059442,"West Kensington, West Cromwell Road, West Kensington, London Borough of Hammersmith and Fulham, Greater London, England, W14 8UQ, United Kingdom"
West Ruislip,51.5695047,-0.4370447,"West Ruislip, Station Parade, Ickenham, London Borough of Hillingdon, Greater London, England, HA4 7DP, United Kingdom"
Westbourne Park,51.5209265,-0.2014098,"Westbourne Park, Tavistock Crescent, Westbourne Green, Kensal Town, Maida Hill, City of Westminster, Greater London, England, W11 1AG, United Kingdom"
Westferry,51.5094025,-0.026644,"Westferry, Limehouse Causeway, Canary Wharf, London Borough of Tower Hamlets, Greater London, England, E14 8FU, United Kingdom"
Westminster,51.5004439,-0.1265398,"Westminster, Millbank, City of Westminster, Greater London, England, SW1P 3JX, United Kingdom"
White City,51.5116219,-0.2245282,"White City, Wood Lane, Shepherd's Bush, London Borough of Hammersmith and Fulham, Greater London, England, W12 7FA, United Kingdom"
White Hart Lane,51.604157,-0.0662604,"Tottenham Hotspur Stadium, Park Lane Square, London Borough of Haringey, Greater London, England, N17 0AP, United Kingdom"
Whitechapel,51.5174861,-0.0659685,"Whitechapel, London Borough of Tower Hamlets, Greater London, England, E1 1DT, United Kingdom"
Willesden Green,51.5493524,-0.222223,"Willesden Green, Station Parade, Mapesbury, London Borough of Brent, Greater London, England, NW2 4NX, United Kingdom"
Willesden Junction,51.5321956,-0.2435041,"Willesden Junction, Station Approach, Harlesden, London Borough of Brent, Greater London, England, NW10 4UY, United Kingdom"
Wimbledon,51.4214787,-0.2064027,"Wimbledon, Greater London, England, SW19 7NL, United Kingdom"
Wimbledon Park,51.4340563,-0.1990432,"Wimbledon Park, Arthur Road, Wimbledon Park, London Borough of Merton, Greater London, England, SW19 8AA, United Kingdom"
Wood Green,51.5972054,-0.1099585,"Wood Green, Greater London, England, N22 6DR, United Kingdom"
Wood Lane,51.5101068,-0.2237557,"Wood Lane, Fountain Park Way, Shepherd's Bush, London Borough of Hammersmith and Fulham, Greater London, England, W12 7SN, United Kingdom"
Wood Street,51.587041,-0.0016791,"Wood Street, Upper Walthamstow Road, Wood Street, Upper Walthamstow, London Borough of Waltham Forest, Greater London, England, E17 3NU, United Kingdom"
Woodford,51.6068074,0.0340219,"Woodford, Charteris Road, Woodford, London Borough of Redbridge, Greater London, England, IG8 0EA, United Kingdom"
Woodgrange Park,51.549168,0.0447283,"Woodgrange Park, Bluebell Avenue, Manor Park, London Borough of Newham, Greater London, England, E12 6UL, United Kingdom"
Woodside Park,51.617938,-0.185523,"Woodside Park, Station Approach, Woodside Park, London Borough of Barnet, Greater London, England, N12 7AX, United Kingdom"
Woolwich Arsenal DLR,51.4901052,0.0695827,"Woolwich Arsenal DLR, Taylor's Buildings, Callis Yard, Glyndon, Royal Borough of Greenwich, Greater London, England, SE18 6EU, United Kingdom"
Woolwich Arsenal NR,51.4956062,0.0708298,"Royal Arsenal Woolwich Pier, Royal Arsenal Riverside, Royal Borough of Greenwich, Greater London, England, SE18 6TL, United Kingdom"
Woolwich EL,,,
